Course Code,Course Name,Credit Value,Details,Prerequisites,Corequisites,Exclusion,Recommended Preparation
EMU130Y1,Introduction to Music Education,0.67,An introduction to concepts and contexts to music education with an emphasis on a critical examination of current practice. Introduction to the basics of various approaches to music teaching and learning. ,,,,
EMU150H1,Instrumental Class: Violin,0.17,Introductory study of violin and viola.,['Complicated'],,,
EMU151H1,Instrumental Class: Clarinet,0.17,Introductory study of the clarinet. ,['Complicated'],,,
EMU152H1,Instrumental Class: Trumpet,0.17,Introductory study of the trumpet. ,['Complicated'],,,
EMU154H1,Instrumental Class: Guitar,0.17,Introductory study of the guitar. Pedagogical considerations for class guitar instruction in popular and classical guitar styles. ,,,,
EMU207Y1,Piano Skills for Professional Musicians/Teachers,0.33,"A practice-based course that develops competency in the playing of chord progressions, simple accompaniments, combinations of parts from open choral scores, combinations of transposing parts from instrumental scores, simple sight harmonization of songs, playing by ear, improvisation, and ensemble playing. A music notation software project will be introduced. This course is limited to those with piano skills at a level equivalent to RCM Level 8 or below.",,,,
EMU230H1,Voice Education,0.17,"Introductory study of voice production with attention to breathing technique, tone development and vocal diction. This course focuses on the development of the singing voice for students seeking a basic understanding of how the voice works for singing. Recommended for music education, instrumental, keyboard and composition students interested in singing. ",['Complicated'],,"['EMU231Y1', 'Complicated']",
EMU231H1,Voice Pedagogy for Young Choirs,0.17,"Introductory study of vocal methods for teaching young choirs with attention to breathing techniques, tone production, vocal diction and rehearsal pedagogies relevant to working with children and youth choirs. Recommended for all students interested in learning to work vocally with young singers, ages 6-16. ",['Complicated'],,,
EMU240H1,Theoretical Inquiry in Music Education,0.50,"This course introduces students to theoretical inquiry in music education in the context of diversity related to students, teachers, music, and music educational settings. Through course readings, individual research, classroom interactions, presentations, and writing short essays, students critique existing theories, and develop concepts articulating their own theories of music education that take into account relevant social, political, and ethical questions. ",['Complicated'],,['EMU275Y1'],
EMU245H1,Psychological Foundations of Music Education,0.50,"This course provides an advanced study of the psychological bases of music education. Students will critically reflect on the strengths and weaknesses of prevailing psychological theories in the context of music teaching and learning. Through seminar presentations, research, and the examination of scholarly literature, students will explore the field of music psychology. ",['Complicated'],,['EMU275Y1'],
EMU252H1,Instrumental Class: French Horn,0.17,Introductory study of the French horn. ,['Complicated'],,,
EMU254H1,Instrumental Class: Trombone,0.17,Introductory study of the trombone. ,['Complicated'],,,
EMU256H1,Instrumental Class: Tuba,0.17,Introductory study of the tuba. ,['Complicated'],,,
EMU260H1,Instrumental Class: Cello I,0.17,Introductory study of the cello. ,['Complicated'],,['EMU350H1'],
EMU262H1,Instrumental Class: Percussion,0.17,Practical study of percussion instruments. Care and maintenance of instruments and equipment. Ensemble playing. ,['Complicated'],,['EMU352H1'],
EMU263H1,Instrumental Class: Flute,0.17,Introductory study of the flute. ,['Complicated'],,['EMU353H1'],
EMU264H1,Instrumental Class: Oboe,0.17,Introductory study of the oboe. ,['Complicated'],,['EMU354H1'],
EMU267H1,Instrumental Class: Saxophone,0.17,Introductory study of the saxophone.,['Complicated'],,['EMU357H1'],
EMU268H1,Instrumental Class: Bassoon,0.17,"Introductory study of the bassoon. One hour, one term. ",['Complicated'],,['EMU358H1'],
EMU270H1,Instrumental Class: Double Bass,0.17,"Introductory study of the double bass. One hour, one term. ",['Complicated'],,['EMU450H1'],
EMU305H1,Survey of Improvisation Practices,0.50,"A performance/pedagogical survey of major improvisational practices and techniques from the Renaissance on; their adaptation and application to classroom and/or private teaching. Students gain experience in a wide variety of improvisational approaches including Renaissance vocal polyphony, baroque/classical embellishment, rock/blues/jazz jamming, “open” (free) improvisation and those related to various ‘world’ traditions.","['TMU231H1', 'TMU232H1', 'JMU200Y1', 'JMU201Y1']",,,
EMU330Y1,Choral Music Education,1.00,"The study and practice of choral music with an emphasis on teaching and learning in school and community choral settings. The course will focus on conducting, programming and score study with an emphasis on rehearsal pedagogy. ","['EMU130Y1', 'EMU230H1', 'EMU240H1', 'EMU245H1', 'Complicated']",,"['EMU330H1', 'EMU331H1']",
EMU355Y1,Accompanying,0.33,"The course focuses on developing pianistic, musical and verbal skills in order to succeed in a broad spectrum of collaborative opportunities during a professional career. In-class accompanying presentations and lectures introduce students to professional musician/teacher requirements through collaborative training.  Practical experience in improvisation, sight-reading. Assignments appropriate to level of keyboard facility.","['TMU105Y1', 'TMU107Y1', 'or equivalent']",,,
EMU356Y1,"Instrumental Music I: Curriculum, Conducting, Rehearsal and Repertoire",1.00,A study of techniques for the instruction and administration of wind and string instrumental programs. Analysis and performance of beginning and intermediate band and string orchestra repertoire. ,['Complicated'],['PMU380Y1'],,
EMU359H1,Jazz Education,0.50,"Analysis, methods and materials for jazz education and improvisation techniques. ","['TMU220H1', 'TMU221H1', 'TMU230H1', 'TMU231H1', 'TMU232H1', 'Complicated']",,,
EMU360H1,Jazz Improvisation for Music Education,0.50,Development of improvisation skills through applied performance and theoretical analysis in a variety of jazz styles.,"['TMU220H1', 'TMU221H1', 'TMU230H1', 'TMU231H1', 'TMU232H1']",,['Complicated'],
EMU370Y1,Principles & Practice of Music Education for Children I,0.67,"This course provides an introduction to the philosophical underpinnings and practice-based theories of music education for children. Students will have the opportunity to study the development of musicianship in childhood and explore common theories and educational approaches through seminars, observations, composition and performance experiences, and microteaching opportunities. ",['Complicated'],,,
EMU371H1,Multimodal Approaches to Music Teaching and Learning,0.50,"This course provides a multitude of approaches to music teaching and learning including informal music learning, music technology, community music and improvisatory and creative musical activities in music classrooms. Students will actively create and perform music while crafting a well-rounded curriculum based on the ideas derived from the course. Philosophical underpinnings of such practices will also be examined. ","['EMU240H1', 'EMU245H1', 'Complicated']",,,
EMU372Y1,Movement & Music: Dalcroze Eurhythmics,0.33,"This course focuses on the pedagogy of Dalcroze Eurhythmics, a music education approach that examines the intrinsic relationships between physical movement and the learning/performing of music. Students make a kinaesthetic connection to a wide variety of music through invigorating combinations of free movement, choreography, singing, conducting, improvisation and music games. ",,,,
EMU410H1,Introduction to Research in Music Education,0.50,"An introduction to modes of research in music education, with particular reference to principles of research design and effective research procedures. Students will prepare critiques of research material and will be guided in designing research projects.","['EMU240H1', 'EMU245H1']",,,
EMU425H1,Music and Urban Engagement,0.50,"This course provides a reflective practicum experience in unique urban settings. Under the mentorship of professional community music teachers, students assist and lead music-making sessions with youth from the Regent Park School of Music and/or youth residing in detention centers. Students have the opportunity to investigate how music is an important tool for social justice.","['EMU240H1', 'EMU245H1', 'EMU370Y1']",,,
EMU430H1,Choral Literature & Conducting I,0.50,The study of choral literature and conducting technique with an emphasis on European classical and Contemporary choral music (including selected choral-orchestral repertoire). The weekly class will meet in a combined literature seminar and conducting practicum with piano and/or small instrumental ensemble.,"['EMU330Y1', 'Complicated']",,['EMU430Y1'],
EMU431H1,Choral Literature & Conducting II,0.50,The study of choral literature and conducting technique with an emphasis on European classical and Contemporary choral music (including selected choral-orchestral repertoire). The weekly class will meet in a combined literature and seminar and conducting practicum with piano and/or small instrumental ensemble. ,['EMU430H1'],,['EMU430Y1'],
EMU435H1,Internship in Music Education,0.50,This course provides a community-based experience that will enable students to merge theory and practice in music education. Students will volunteer for three hours a week in a community music or school setting of their choosing. Placements must be approved by the instructor during the first week of classes.,"['EMU240H1', 'EMU245H1', 'EMU356Y1', 'EMU330Y1', 'EMU370Y1', 'EMU361Y1']",,,
EMU437H1,Internship in Anti-Racist and Anti-Oppressive Music Education,0.50,"Students will undertake a unique internship opportunity in partnership with the Toronto District School Board and the Marigold Team (a Black-led organization with a mission to change the visual landscape of music education). Students will lead a series of music education workshops, in schools identified as high needs, that explore culturally relevant and culturally responsive music education through an anti-oppression and anti-racism lens. The focus will be on prioritizing the socio-emotional awareness and well-being of students, while facilitating conversations about historical practices in music education that value one form of musicking over another. Students will be mentored by leaders in Equity, Diversity, and Inclusion. Placements must be approved by the instructor during the first week of classes.","['EMU240H1', 'EMU245H1', 'EMU356Y1', 'EMU330Y1', 'EMU370Y1', 'EMU361Y1']",,,
EMU456Y1,"Instrumental Music II: Advanced Curriculum, Conducting, Rehearsal & Repertoire",1.00,Practical instrumental lab. Selected lecture topics related to teacher effectiveness in an instrumental program. In-field observation and participation. ,['EMU356Y1'],,['PMU480Y1'],
EMU461H1,Music Education in Cultural Perspective,0.50,"A seminar exploring music's social nature, with special attention to the ways culture influences music perception, cognition, and value, and the way musical practices in turn influence culture and social relations. Issues addressed include: music education as intercultural education; music, gender, and power; the educational implications of cultural relativity; music education as an agent of social reproduction and/or transformation; social relations implicit in various musical and instructional practices; and music education's moral significance. Emphasis is placed on practical pedagogical applications of world music. ","['EMU240H1', 'EMU245H1', 'Complicated']",,,
EMU485H1,Advanced Topics in Music & Childhood,0.50,"Designed as a continuation of EMU370Y, this course will give students an opportunity to study issues pertaining to the practice of culturally relevant and responsive music teaching and learning strategies in childhood. Students will begin to formulate their own theory for the curricular development of programmes for children and school and community school contexts. Seminars and practicum experiences will be supplemented by individual research projects.",['EMU370Y1'],,,
EMU499H1,Independent Study,0.50,"An intensive research project under the supervision of a faculty member. The project must be academically demanding and uniquely suitable for the individual student. Students propose a topic that is currently not covered in the curriculum or one that warrants further exploration related to research interests and/or musical goals. Available to students in 4th year on successful completion of several EMU courses; minimum cumulative GPA of 3.3 (B+) and availability of a full-time faculty advisor from the Music Education division. Modes of assessment are determined through discussion between student and supervisor, but will usually include a public presentation of the research project.",['Complicated'],,,
HMU111H1,Introduction to Music and Society,0.50,An examination of musical thought and practice in non-Western and Western traditions. ,,,['Complicated'],
HMU126H1,Historical Survey II,0.50,Western music from 1750 to the present. ,,,"['HMU226H1', 'Complicated']",
HMU225H1,Historical Survey I,0.50,Western music up to 1750. ,['Complicated'],,['Complicated'],
HMU301H1,Ethnography of Art Music,0.50,"This seminar surveys ethnographic approaches to the study of art music performance. Students read ethnographies of Western art music (as performed in and outside the “West”) and of African, Asian, and Middle Eastern canonical traditions. Students consider issues in the performance and analysis of contemporary art music, and practice methodologies of participant-observation and performative ethnography.","['HMU111H1', 'HMU126H1', 'HMU225H1', 'JMU210H1']",,,
HMU307H1,"Music, Sound, and the Erotic",0.50,"This seminar surveys musical and sonic genres intended or perceived to be erotic. Students read foundational literature in the study of performance, gender and sexuality, the senses, and sound. Students analyze erotic genres across historical periods and generic categories, including Goa trance, early modern Italian song, Sumatran saluang, African American soul, ASMR, sound baths, and audio pornography.","['HMU111H1', 'HMU126H1', 'HMU225H1', 'JMU210H1']",,,
HMU345H1,Global Popular Musics,0.50,"Global Popular Musics is an introduction to popular music in its social and cultural context in a variety of international settings. Genres to be covered may include, but are not limited to, rock, hip-hop, country, and “world music”. The course will take an issues-based approach to the study of popular music, focusing on topics such as the interplay of tradition and modernity; media and technology; race, gender, sexuality, class, and other facets of identity; urbanization and migration; and the markets and legal structures surrounding music.","['HMU111H1', 'HMU126H1', 'HMU225H1']",,['HMU245H1'],
HMU380H1,Operas of Mozart,0.50,"Study of the music, drama, and staging of the operas, with reference to historical and cultural contexts.","['HMU111H1', 'HMU126H1', 'HMU225H1', 'JMU210H1']",,,
HMU425H1,Topics: Medieval Music,0.50,"Plainchant and polyphony, including topics for individual research.",['Complicated'],,['HMU330H1'],
HMU431H1,Topics: Romantic Music,0.50,"Instrumental and vocal genres, including topics for individual research.",['Complicated'],,,
HMU432H1,Topics: 20th Century Music,0.50,"Developments and trends since 1910, including topics for individual research.",['Complicated'],,,
HMU433H1,Topics: Ethnomusicology,0.50,"The history of the discipline from its roots in Comparative Musicology in the 1880s to the modern, holistic study of music and society. Other topics include transcription, transmission, and cultural appropriation. A variety of the world's traditions are illustrated with audio-visual materials, and students contribute personal surveys, analyses and debates.",['Complicated'],,,
HMU499H1,Independent Study,0.50,"An intensive research project under the supervision of a faculty member. The project must be academically demanding and uniquely suitable for the individual student. Students propose a topic that is currently not covered in the curriculum or one that warrants further exploration related to research interests and/or musical goals. Available to students in 4th year on successful completion of the core HMU requirement plus at least 1.0 credit in HMU courses at the 300 level or higher, minimum cumulative GPA of 3.3 (B+), and availability of a full-time faculty advisor from the History & Culture division. Modes of assessment are determined through discussion between student and supervisor, but will usually include a public presentation of the research project.",['Complicated'],,,
JMU100Y1,Jazz & Traditional Materials,0.67,"The study of harmony, melody and counterpoint in both traditional and jazz musical forms. Written and analytical studies of music from various jazz idioms and traditional repertoire. ",,,,
JMU101Y1,Jazz & Traditional Ear Training,0.67,"Corresponding with materials studied in JMU100Y. Melodic, harmonic and rhythmic dictation; sight singing. Transcription of jazz solos and group performances. ",,,,
JMU104Y1,Jazz Keyboard Skills,0.33,Basic keyboard skills for jazz majors who play instruments other than piano. Credit for the course may be obtained by passing an examination.,['Complicated'],,,
JMU184Y1,Jazz Applied Music,0.50,Individual instruction on major instrument or voice. One hour weekly (to a total of 24 lessons).,['Complicated'],,,
JMU185Y1,Jazz Applied Music,1.00,Individual instruction on major instrument or voice. One hour weekly (to a total of 24 lessons).,['Complicated'],,,
JMU189Y1,Jazz Orchestra,0.67,"While a major ensemble for students enrolled in jazz performance, this ensemble is open to other performers by audition. Students rehearse and perform in concerts as assigned by the Performance Division throughout the academic year. Attendance at all assigned sessions is required. Six hours minimum. ",['Complicated'],,,
JMU191Y1,Jazz Improvisation,0.50,"This course examines the artistic and technical aspects of improvised jazz performance. Analysis of improvised solos and group performances, approaches to practicing, developmental techniques and exercises, and general performance skills are among the topics covered. ",['Complicated'],,,
JMU192Y1,Small Jazz Ensemble,0.50,"Students are assigned to small jazz ensembles by audition, rehearsing with faculty for one hour and independently for an additional two hours each week. Repertoire ranges from traditional to contemporary jazz styles. Attendance at all assigned sessions is required. Three hours minimum. ",['Complicated'],,,
JMU193Y1,Vocal Jazz Ensemble,0.67,"While a major ensemble for students enrolled in jazz performance, this ensemble is open to other performers by audition. Students rehearse and perform in concerts as assigned by the Performance Division throughout the academic year. Attendance at all assigned sessions is required. Six hours minimum",['Complicated'],,,
JMU200Y1,Jazz & Traditional Materials,0.67,"The study of harmony, melody and counterpoint in both traditional and jazz musical forms. Written and analytical studies of music from various jazz idioms and traditional repertoire. ",['JMU100Y1'],,,
JMU201Y1,Jazz & Traditional Ear Training,0.67,Corresponding with materials studied in JMU200Y1. See JMU101Y1. ,['JMU101Y1'],,,
JMU210H1,Jazz History I,0.50,"Jazz History I begins with Ragtime era (early 20th century), and proceeds through the Jazz Age (1920s), Swing (1930s), Bebop (1940s), and Post Bop periods (1950s), culminating in the pivotal musical year of 1959. A historical timeline shows how the evolution of the music reflected and influenced societal events. ","['HMU111H1', 'HMU126H1']",,"['HMU133H1', 'HMU351H1']",
JMU215H1,Jazz History II,0.50,"Jazz History II begins in the 1960s with the music that ushered in the modern era of jazz (Miles Davis Quintet, free/avant-garde, jazz-rock). It explores the myriad paths and styles that have been incorporated by jazz musicians of the past fifty years, up to the present day. ",['JMU210H1'],,,
JMU284Y1,Jazz Applied Music,0.50,Individual instruction on major instrument or voice. One hour weekly (to a total of 24 lessons).,['Complicated'],,,
JMU285Y1,Jazz Applied Music,1.00,Individual instruction on major instrument or voice. One hour weekly (to a total of 24 lessons).,['Complicated'],,,
JMU289Y1,Jazz Orchestra,0.67,"While a major ensemble for students enrolled in jazz performance, this ensemble is open to other performers by audition. Students rehearse and perform in concerts as assigned by the Performance Division throughout the academic year. Attendance at all assigned sessions is required. Six hours minimum. ",['Complicated'],,,
JMU291Y1,Jazz Improvisation,0.50,"This course examines the artistic and technical aspects of improvised jazz performance. Analysis of improvised solos and group performances, approaches to practicing, developmental techniques and exercises, and general performance skills are among the topics covered. ",['JMU191Y1'],,,
JMU292Y1,Small Jazz Ensemble,0.50,"Students are assigned to small jazz ensembles by audition, rehearsing with faculty for one hour and independently for an additional two hours each week. Repertoire ranges from traditional to contemporary jazz styles. Attendance at all assigned sessions is required. Three hours minimum. ",['Complicated'],,,
JMU293Y1,Vocal Jazz Ensemble,0.67,"While a major ensemble for students enrolled in jazz performance, this ensemble is open to other performers by audition. Students rehearse and perform in concerts as assigned by the Performance Division throughout the academic year. Attendance at all assigned sessions is required. Six hours minimum",['Complicated'],,,
JMU302H1,Advanced Ear Training & Harmony,0.33,"A continuation of JMU201Y1, this course addresses advanced ear training and theoretical concepts including ""upper structure"" voicings/chord extentions which are commonly found in post-bebop and contemporary jazz harmony. Analysis and performance of the work of influential composers such as Wayne Shorter and Kenny Wheeler will be central in this course.",['JMU201Y1'],,['JMU301Y1'],
JMU303H1,Rhythm for Improvisers,0.33,"This course focuses on methods for students to expand their rhythmic vocabulary as improvisers and composers. Motivis development, rhythmic modulation and odd time signature playing will be addressed. Analysis and performance of the music of influential contemporary composers such as Dave Holland will be central to this course.",['JMU201Y1'],,['JMU301Y1'],
JMU305H1,Introduction to Jazz Theory,0.50,An introduction to jazz theory for music students not in a jazz program. Course includes analysis and written exercises in various jazz forms and idioms. Some listening and improvisation activities may be included to reinforce and apply theoretical concepts.,"['TMU231H1', 'TMU232H1']",,,
JMU317Y1,Jazz Arranging,0.67,Instrumental and vocal arranging for various jazz ensembles from duos to large jazz band and studio orchestra. Two hours. ,['JMU200Y1'],,,
JMU320H1,Jazz Pedagogy,0.33,"This course will focus on developing students’ leadership and instructional skills within the jazz genre. Through discussions, readings, case studies, and performance reviews, students will hone their ability to mentor musicians in ensembles, lectures, and one-on-one teaching environments, typical in the jazz discipline.",['Complicated'],,,
JMU384Y1,Jazz Applied Music,0.50,Individual instruction on major instrument or voice. One hour weekly (to a total of 24 lessons).,['Complicated'],,,
JMU385Y1,Jazz Applied Music & Recital,1.00,Individual instruction on major instrument or voice. One hour weekly (to a total of 24 lessons) and recital. ,['Complicated'],,,
JMU389Y1,Jazz Orchestra,0.67,"While a major ensemble for students enrolled in jazz performance, this ensemble is open to other performers by audition. Students rehearse and perform in concerts as assigned by the Performance Division throughout the academic year. Attendance at all assigned sessions is required. Six hours minimum. ",['Complicated'],,,
JMU391Y1,Jazz Improvisation,0.50,"This course examines the artistic and technical aspects of improvised jazz performance. Analysis of improvised solos and group performances, approaches to practicing, developmental techniques and exercises, and general performance skills are among the topics covered. One hour. ",['JMU291Y1'],,,
JMU392Y1,Small Jazz Ensemble,0.50,"Students are assigned to small jazz ensembles by audition, rehearsing with faculty for one hour and independently for an additional two hours each week. Repertoire ranges from traditional to contemporary jazz styles. Attendance at all assigned sessions is required. Three hours minimum. ",['Complicated'],,,
JMU393Y1,Vocal Jazz Ensemble,0.67,"While a major ensemble for students enrolled in jazz performance, this ensemble is open to other performers by audition. Students rehearse and perform in concerts as assigned by the Performance Division throughout the academic year. Attendance at all assigned sessions is required. Six hours minimum",['Complicated'],,,
JMU410Y1,Jazz Composition,0.67,Studies leading to the development of a personal and creative compositional style. Analysis of selected compositions. Two hours. ,['JMU317Y1'],,,
